<!ELEMENT branches (branch+)>
<!ELEMENT branch (address, contact, hours, mapUrl)>
<!ELEMENT address (#PCDATA)>
<!ELEMENT contact (#PCDATA)>
<!ELEMENT hours (#PCDATA)>
<!ELEMENT mapUrl (#PCDATA)>
